term	description
亮点 liàng diǎn	Highlight; a metaphor for (someone or something) to be attractive and eye-catching (只有一处-。 There was one bright spot; 斯堪的纳维亚的- The Scandinavian Highlights; 他的人格中有很多- He has many great qualities as a person)
亮晶晶 liàng jīng jīng	Glittering, glistening, sprakling, shining 夜空有数不清的-的星星
靓	Beautiful, fashionable, good-looking
靓女	Beautiful woman, pretty girl
靓汤	Delicious soup
靓仔	Handsome young man
猎头 liè tóu	Headhunting -公司
临时抱佛脚 lín shí bào fú jiǎo	Make effort at the last moment; cram (他们得熬夜- They have to stay up late cramming)
另类 lìng lèi	Different, special, completely new of fashionable type or trend (卡布尔也是一个很-的城市 Kabul is a different city)
流动人口	Floating or transient population
流口水	Mouth watering; long for something 这食物令我-
流浪猫 liú làng māo	Abandoned cat, stray cat
流浪软件 liú làng ruǎn jiàn	Rascal software, malware, spy ware
流通股 liú tōng gǔ	Circulation stock
留守儿童 liú shǒu ér tóng	Rear children; a child left to live with his or her grandparents or relatives while the parents go to work in another place or province
龙头	Leader; the leading things
龙头企业	Leading company
隆胸 lóng xiōng	Breast augmentation
楼盘 lóu pán	Building (residential highriser) 许多-都有排队候选名单 Many buildings have waiting lists)
楼市	Property market
露脐装 lù qí zhuāng	Bare midriff
驴友 lǚ yǒu	Backpacker buddy; hiking fellows; those who travel together
绿色食品 lǜ sè shí pǐn	Green food; organic foods without chemical additives
乱搭 luàn dā	1) Miss-matched (clothes) 2) Illegal construction
论坛 lùn tán	Forum
裸奔 luǒ bēn	Nude run
落马 luò mǎ	Fall of the horse; a metaphor for a government official losing his post for comitting a crime or for illegal activities
马长城	Play mahjong
埋单	Pay the bill
卖座	(of a theater, cinema, etc.) draw large audiences; (of a movie, etc.) be a box-office success; (of a restaurant, club, etc.) attract many customers (那是-片 That movie is a box-office hit)
盲流 máng liú	Blind influx; it refers to people, mainly laborers, who are aimlessly flowing from rural areas or small towns into large cities
猫	1) Modem 2) Hide
猫腻 māo nì	Illegal deal, underhanded activity
毛坯房 máo pī fáng	Rough housing, raw housing (house with no fittings)
没劲	1) Uninteresting, boring 打扑克-; 这酒- 2) (of a person) good-for-nothing, not very promising, disappointing
没门儿	No way, can't do it -，你有你自己的那一半 No way, you got your own
没脾气 méi pí qì	Cannot lose one's temper; helpless; mild tempered
没谱	1) Unsure, unrealistic, be irrelevant, unsettled 2) Have no idea, not know 我心里全然-
没戏	Have no hope; hopless, impossible
没辙 méi zhé	Have no other way out, have no solution
没治	1) Hopless, helpless 你真- 2) Extremely great
美眉	MM; an abbrevation for beautiful girls
猛男 měng nán	Valiant man, strong man, brave man
面	Weak, lax, slow
名人效应 míng rén xiào yìng	Celebrity effect 于是英国媒体开始发生变化，变得越来越为-所驱动 The British media is changing. It is becoming much more celebrity-driven)
名嘴 míng zuǐ	Famous pundit (of television anchor, host or hostess)
摩的	Motorbike taxi
脑残 nǎo cán	Mentally retarded, addle minded; also used in the cartoon field to refer to characters of cartoons drawn with idiot looks Used about spoiled "90hou)
闹心 nào xīn	Be worried or disturbed, be vexed 这事真-! This sucks!
能耗 néng hào	Energy consumption 人均- Energy Consumption Per Capita
黏糊	1) Sticky, glutinious 2) Slow in action, in low spirits 这人真- He is very dull 3) Like to be together
鸟巢 niǎo cháo	Bird's Nest; Beijing's national stadium which looks like a big bird's nest
牛	Proud, arrogant, self-important
牛市	Bull market
农民工	Farm worker, migrant worker, rural labor
暖冬	Warm winter
欧III标准	European emission standards
偶像派 ǒu xiàng pài	Idol type with good looks
呕像	Disgusting person who makes you want to vomit, a homophone of 偶像, but with a contrast meaning
拍砖 pāi zhuān	Hit somebody with a stone; a metaphor for criticizing somebody on blog or BBS
派对	1) Party 2) Make pairs, matchmaking
盘活 pán huó	Make alive, rejuvenate
跑吧	Indulge oneself for a long time in bars (wine bars or Internet bars)
泡沫经济	Bubble economy
泡汤 pào tāng	Fall flat, fall through (of plans), fail, be done for, be unsuccessful, come to nothing; be fruitless 原先的计划已经-了 The original plan has gone to wreck
陪聊 péi liáo	Accompany somebody to chat
喷饭 pēn	Spurt put food with laughter; something which is so funny and ridiculous that makes someone spew out their food (at meals) (令人- screamingly funny)
碰瓷儿	Porcelain-crashing; intentionally throwing oneself onto or in front of a moving car to get compenation
疲软	1) (of a person) Fatigued and weak 2) Weak, slumping, sluggish (in market) 市场是-的 The market is very quiet; 美圆- The U.S. Dollar is weakening
飘红 piāo	Enjoy positive red figures
票房	Box office (of a cinema, theater, stadium) -有票 Tickets are available at the box office; 这个电影的-很失败 This film is a big flop at the box office
品味	Taste 你的-很高雅 You have wonderful taste; 缺乏-的人 A person with uncultivated tastes
评价医院	Fair-price hospital
平台	Platform, opportunity
齐活 qí	Be done, be over or finished
起哄 qǐ hòng	to heckle 他去他们的会议-
起腻 nì	Bother someone; pester, nag
汽车美容	Car beauty, car care
潜规则 qián guī zé	unwritten rules 给教师送礼已经成为一种"-"
强	Strong, excellent, good
强强联合	Make joint effort through integration of excellent enterprises
强势	Strong force, driving force -推进全面建设小康社会步伐
抢眼 qiǎng yǎn	Eye-catching 但是因为报道的标题并不-，也并没有引起注意; 万事达公司一季度同样表现- MasterCard had a strong quarter)
亲和力	Affinity
青蛙 qīng wā	Frog; bad-looking man (net language)
情商	E.Q. (emotional quotient)
全球变暖	Global warming
拳头产品	Competitive products, knock-out products, blockbuster
热炒	Promote frequently in media, increase in value due to popularity
热点	Hot spot -新闻 Hot news; 高加索"-"浅析 A Brief Analysis on Hot Spots in Caucasus
热线	Hot line
热销	(of goods) In great demand; sell like hot cakes; hot sale 什么书最-? What book has sold best?
人脉 rén mài	contacts; network 你可以得到想要的-，不过无法独自做到。这是走后门的好时机
人气	Popularity (他的慷慨为他获得了-。 His generosity gained him popularity)
肉	1) Not crisp, mushy 2) (of a person) slow in getting things done; not frank; not straightforward
软广告	Soft ads; a type of advertisement in the form of a newspaper or magazine article of short TV show; it tells life stories of clients enjoying certain products so as to create a good image of the product
软句	Soft excuse, refuse in a reasonable way
软肋 lèi	Weak point; Achilles' heel
软势力	Soft power
软着陆 ruǎn zhuó lù	soft landing 1993年政府开始实施稳定和调整政策，实现了我国经济的-
弱势群体	Weak group, socially vulnerable group
弱智 ruò zhì	Weak-minded, mentally defiicient, stupid -的孩子 a mentally retarded child
三高	Three highs (1. High degree, high income and high position 2. High blood pressure, high blood fat (hyperlipidemia) and high blood sugar (hyperglycemia))
三农	Three problems of agriculture
三栖明星 qī	Tri-circle star; an actor or actress popular in film, television and song circles
杀价	Force down the price, chop down the price 我大概可以找店主- I can probably get the owner to bring down the price; 这件商品被她-杀到了100美元 She beat the merchant down $100
杀熟	Metaphor for cheating one's acquaintances
沙尘暴 shā chén bào	sandstorm
沙发	1) Sofa 2) Sofa grabbing, originating from the pronunaciation of "so fast", a term used in network referring to the first one who sends a message in reply to a host blog
晒工资	To put one's salary amount on the net
煽情 shān qíng	to stir up emotion 我弟弟给我讲了个十分-的故事，所以我借给他10美元 My brother told me a real sob story. So I lend him $10; 别这样子，别只凭书的封面判断它，封面可能看来-的，但故事并非如此，我已经看过了 Come on, dont judge a book by its cover. The jacket may look sexy but the story isnt, Ive read it
闪	1) Dodge, get out of the way 2) Trick fool
闪存 shǎn cún	Flash memory
闪婚	Lightning marriage, instant marriage; refers to people who get married as quickly as lightning after knowing each other for a very short time
闪局	Cohabit with an unfamiliar person shortly after meeting him or her
商海	Business field, commercial circle
商品房	Commercial residential building
商业贿赂 huì lù	Commercial bribery
商战	Trade war, price war
上火	1) Suffer from excessive internal heat (with such symptoms as constipation, conjunctivits, and inflammation of the nasal and oral cavities) 2) get angry
上扬	Rise, go up 股票价格今日-
上座率	Box-office rate
烧钱 shāo	Burn money, a metaphor for spending money quickly 经理人们还有可能是在上世纪90年代投资-热中学到了教训 Managers may also have learned a lesson from the investment splurge of the 1990s
蛇头 shé tóu	Snakehead; refers to the heads or key figures in organizations that smuggle immigrants
神	Supernatural, magical, amazing
神六	Shenzhou-6 spacecraft
审美疲劳 shěn	Aesthetic tiredness, tiredness in aesthetics (很多娱乐节目都是一个模子，会造成给观众-)
生态旅游	Eco-turism
十一五规划	The 11th five-year plan 2006-2010
食品安全	Food security (safety)
事儿	1) Way, means, measure 2) Meddlesome, troublesome, overly concerned
视觉污染	Visual pollution
视频聊天	Video chat
试婚	Trial marriage
瘦身 shòu shēn	1) Get one's body thinner; slim down 2) Metaphor for streamlining administration or downsizing an organization
梳理 shū lǐ	Put something in order; disentangle (a confused situation), readjust
数字化	Digitalized (将（例如数据）- To put(data, for example) into digital form)
数字家庭	Digital home, digital household; this means a fully automated residence. China is trying to help more and more families access to Internet servicess and other home appliances powered by digital technology
刷卡	Pay by credit card
刷大牌	Put on air, make a show of authority, throw one's weight about
衰 shuāi	Bad luck, be down on one's luck
帅呆 shuài	(of males' appearance) very handsome, outstanding
	Trick, fool, deceive
双轨 shuāng guǐ	Double-designation; this term means a special investigation scheme of the CCP when a member of official of the Party os ordered to make an explanation of his/her alleged involvement in a discipline-violation or corruption case at a designated time and in a designated place
双开	Double expulsion; expel someone from the Party and from their adminstrative post as a punishment for corruption
双赢 shuāng yíng	Win-win
爽 shuǎng	1) (of someone's nature) straightforward, frank, fortright, effecient; do something quickly 2) To feel well, comfortable
顺	1) Walk off with something, pick up something on yhe sly; shoplift, steal 2) Hany, convient and easy to use; smoothly; without difficulty
死定了	1) Be doomed to die or fail to lose 2) Be doomed to be criticized or punished
死扛 (káng)	1) Go all out to support or shoulder responsibilites 2) Refuse to confess or reveal information
死性	Stubborn, obstinate, inlfexible, stiff; having a one-track mind
素质	inner quality, tact 教育泛滥，-低下
素质教育	Education of all-round development
速配	Speed dating
塑身 sù shēn	body sculpting (weight loss and exercise)
酸雨 suān yǔ	acid rain
随便	As you wish, to suit oneself
锁定 suǒ dìng	1) Lock, stay tuned 2) Be interested in something, be in favor of
抬杠 tái gàng	to bicker (你为什麽老是喜欢-? Why do you always like to have the last word?)
太有才了	So talented, too talented 你真是~！
探班 tàn	Visit an actor or actress at the filming site
探地 tàn	Touch the bottom, down to the bottom 美股~反单。
陶吧 táo	Pottery bar
套瓷 tào cí	Cotton up to; try to establish a relationship with someone 他见到一个人就上去跟人家~，也不管人家愿意不愿意。
套近乎 tào jìn hu	Try to get in favor with someone 他有求于我，所以他才跟我~。
套牢 tào láo	to immobilize with a lasso; be tied up, consumed by 被股票~并不是什么怪事
踢皮球 tī pí qiú	Kick a ball; a metaphor for kicking something back and forth like a ball; passing the buck 政府部门遇事不再~，大大提高了办事效率。
提速 tí sù	Raise speed, lift speed
添堵 tiān dǔ	Increase someone's vexations; be a bother 见到她你可千万别提这伤心事，免得给她~。
添乱 tiān luàn	Increase the confusion or chaos; add to the trouble 你快走吧，别给我在这儿~，我都忙死了。
调侃 tiáo kǎn	Joke, ridicule 他是一个幽默的人，喜欢~。
挑染 tiāo rǎn	Highlight (hair)
跳槽 tiào cáo	to change jobs 听说他~去了一家外企。
跳楼价 tiào lóu jià	Distress price, sale at breakdown price; it refers to selling something at an extremely low price
跳水	Nose dive; a rapid fall in the stock market
跳水价	Cheap price, discount price
铁杆 tiě gān	Loyal 他是个~儿球迷。
帖子 tiě zi	1) Messages posted on BBS 2) Invitation card
土	1) Unsophisticated 你可真~ 2) Old-fashioned 这件衣服太~了
脱贫致富 tuō pín zhì fù	Cast off poverty and set out on a road to prosperity
外出务工人员	Migrant workers
外援	1) Foreign player 2) Foreign aid
外资银行	Foreign bank
完菜	Over, finish with disappointing results 这件事看来要~
网吧	Internet café
网虫	Web norm; a metaphor for Internet geek, Internet buff
网考	Internet-based test
网恋	Online love affair, online dating
网络暴民	Internet mob
网络空间	Cyber space
网民	Netizen
网校	Net school
网友	Net friend
腕儿 wàn	Celebrity 他如今可是歌坛上一个不小的~了
维和	Peace keeping (abbr.)
维权	Human rights defence (abbr.)
温室效应	Greenhouse effect 二氧化碳形成-
文博会	Intl' Cultural Industry Fair (abbr.)
文化创意产业	Cultural and creative industry
乌鸦嘴 wū yā zuǐ	Crow's mouth (Chinese believe the crow cawing could bring an unlucky spell on people. This term is a metaphor for someone who often speaks bad things or inauspicious words.)
物权法	Property law
夕阳红 xī yáng hóng	Sunset glow; it refers to happiness or joyful and glorious time of the elderly
希望工程	Project Hope (a project to enlist popular support to help children of poor families recieve schooling)
西部大开发	Development of China's Western Regions
嬉哈族 xī hā zú	Hip-hop fans
洗牌 xǐ pái	Shuffle; a metaphor for restructuring an industry 发牌者正在-
瞎菜 xiā cài	Have no way out; be finished, be at the end of one's hope
瞎咧咧 xiā liē liē	Make irresponsible remarks; speak groundlessly, talk nonsense 别听他-
下岗职工	Laid-off workers
下网	to go offline 我要~了，有事给我发短信
相当 xiāng dāng	Quite, fairly, rather 这不新片可是~的好看
香车美女	Fragrant cars and beautiful women
消费税	Consumption tax
小贝	The nickname for David Beckham
小罗 luó	The nickname for Ronaldinho
小品	skit, sketch 这台晚会太难看了，唯一令人看得上的也就是那个-了。
小强	cockroach (slang)
小升初	students going from primary school to middle school
小资	1) Petty Bourgeois 2) Emotional appeal; taste
笑星	well known comedians or cross-talkers
歇菜 xiē cài	stop it! (recent Beijing and internet slang)
邪 xié	irregular, abnormal, strange
邪门 xié	abnormal, weird, strange, odd 他的情绪真-儿，一会儿哭，一会儿笑。
新新人类	New generation; people born during the 1980s and 1990s
信息高速路	Information superhighway
信息化	Information-based, informationization 没有~，便没有经济的腾飞
形象大使	Image ambassador
形象工程	Image improvement project
熊	Timid, faint-hearted
熊市	Bear market; (stock) market with falling prices
悬	1) Dangerous, precarious, perilous 2) Almost impossible
悬的乎	Dangerous, perilous, unsafe
选秀	Beauty contest show, talent show 许多大学篮球选手都可能会宣布参加NBA-。Many college basketball players are likely to declare for the NBA draft.
循环经济	Circular economy, cyclic economy
亚健康	Sub health, sub-state of mental health 血细胞低是-状态，你要注意点。
洋	1) Foreign flavor, Western style 2) Foreign, outlandish, stylish
养犬 yǎng quǎn	Dog raising, dog breeding
养眼 yǎng yǎn	Pleasing to the eyes, eye candy 胡萝卜是-蔬菜。
氧吧	Oxygen bar (for oxygen therapy), fresh
幺蛾子 yāo é zi	Crafty plot, wicked idea or thing, a trick
摇头丸 yáo tóu wán	Ecstasy (a narcotic)
野蛮女友 yě mán	Wild girlfriend; this term originates from a Korean movie, My Sassy Girl. It refers to girls who like to ill-treat their boyfriends
夜猫子	Night owl; a metaphor for a person who stays up late at night
一把手	1) Leading official in a unit; number one, first-in-command 2) Good hand, able person
一步到位	To reach one's goal in one step 装修就该-，省得以后麻烦。
一卡通	Smart card, all-purpose card
伊妹儿 yī mèi er	E-mail
以人为本 yǐ rén wéi běn	People-oriented, people foremost, human-oriented 我们应认真做好-。
异类 yì lèi	1) Alien species (of birds， animals, grass, ghosts, etc.) different form humans 2) Alien; different from others; strange, odd
应急预案 yìng jí yù àn	Emergency planning, contingency plan
应试教育 yìng shì jiào yù	Exam-oriented education
影响市容 yǐng xiǎng shì róng	Affect (impair or harm) a cities image, negatively affect the image of a city
优化重组 yōu huà chóng zǔ	Optimize and reorganize
悠着点 yōu zhe diǎn	Take it easy 年纪大了，干活儿要-。
油	Oily, slick, glib
油耗子 yóu hào zi	1) Gas mouse; a metaphor foe someone who steals gas from others' vehicles 2) Illegal dealer in petrol and diesl oil
游商 yóu shāng	Wandering dealer, one who doesn't have a booth to sell goods, but sell them on the streets or anywhere he goes
有偿新闻 cháng	Paid news
有门	Have a way out, be hopeful 我看李杨找工作的事-儿。
有戏	Hopeful, possible, likely 出国旅游的事儿-吗？
有氧运动	Aerobic exercise
预计 yú jì	Entartainment reporter; reporter who reports on entertainment news
舆论导向 yú lùn dǎo xiàng	Direction of public opinion
郁闷 yù mèn	Bored, depressed; a phrase used by the young to express a fretful bad mood 每当他-时，总是靠酒来排忧，这样很不好。
原生态	Original ecology, primitive
月光族	Moonlight clan, refers to people who spend all their salary every month
晕 yūn	No way out; incredible; out of expectation
晕菜	Feel dizzy, get confused, be muddleheaded
造势 zào shì	Create an atmosphere; promote
噪音污染 zào	Noise pollution
增值服务 zēng	Value-added service
扎堆 zhā duī	Get together, gather around 下课后，同学喜欢-做游戏。
摘牌 zhāi pái	Delist 那家律师事务所严重违规，已被-。
涨停 zhǎng tíng	Harden, rise to become stable
朝阳行业 cháo yáng	Sunrise industry
招商引资 zhāo shāng yǐn zī	investment promotion
找不着北 zhǎo bu zháo bě	to be confused and disoriented
找辙 zhǎo zhé	to look for a pretext
真格的	Serious, real, true, to mean what one says 看来你还真和我动-了。So you really are going to oppose me.
整改	Reform and consolidate 抓住这两个问题作为-的突破口。
整合	Integrate, consolidate, unify, unite 我们小一点的部门正在被-成一个中央部门。
知本家	Knowledge capitalist; it refers to intellectuals who have become rich by using their knowledge
执政能力	Ruling or governing ability
直销 zhí xiāo	Direct sale
治理整顿 zhì lǐzhěng dùn	Imporve the economic environment a rectify economic order
智商 zhì shāng	Intelligence quotient, IQ 大量的考试不是测试-的好办法。
智障 zhì zhàng	Mentally handicapped
中超	Abbrevation for Chinese Super League, CSL
钟点工	Hourly worker usually referring to housekeepers who are paid by the hour, also called XIAOSHIGONG
钟点养老	Care-service for senior citizens charged on an hourly basis
主打产品	Dominant product, main product
主打歌	Key song, theme song
主旋律 zhǔ xuán lǜ	1) Theme, principal melody 2) Theme, main idea, basic concept
注水 zhù shuǐ	Infuse water into something unreal, untrue; a metaphor for adding unreal things to something
抓瞎 zhuā xiā	Find oneself at a loss
专卖店	Exclusive agency, franchised store
转轨 zhuǎn guǐ	Change tracks, change (the existing structure, etc.) 由计划经济向市场经济-。
转会	Transfer to another club 彼得五年中-三次。
转基因 zhuǎn jī yīn	genetic modification
转制	System transformation
装嫩 zhuāng nèn	Pretend to be childish, lovely or young; it refers to one who speaks, dresses, or acts like a young girl or boy
装样蒜 zhuāng yàng suàn	Pretend
撞大运	Try one's luck, blind luck 他们的雇佣制度似乎是一种-的事情。
追尾	Bump into the rear of the car in front, tailgate 大雾使高速公路上已经发生了几起-事故。
追星族	Fans, groupies, star chaser
准房奴	Quasi-house slave, house slave-to-be; a term referring to someone working exceptionally hard to earn money to buy a house
准妈妈	Mother-to-be
自驾游	Self-drive trip; this term refers to people driving themselves to holiday or leisure destinations
自主创新	Innovation, indigenous innovation
自主品牌	Self-owned brand
自助游	Self-help trip, self-help travel; this term refers to people who plan their own trips rather than engaging the services of a travel agency
综合国力	Comprehensive national strength
综合治理	Comprehensive treatment or administration
走出去	"Going abroad" Strategy
走人	Go, leave 如果你不想在这儿干，就-。
足球流氓	Football hooligan
组合	Combination, group 参加这次声乐比赛的选手中有六个多人-。
钻石王老五 zuàn	Very wealth bachelor
醉驾 zuì jià	Drunk driving
做大做强	Be big and strong 发展绿色食品是食品企业-的必由之路。
做局	Lay a trap 股市里有那么多特别聪明的人为股票价值-。
做人要厚道	Be honest and kind (a phrase from a famous movie) 你做事情不要太过分，-。这样，以后遇到困难难时才会有人帮你。
做秀 xiù	Show 湖南卫视善于-，超级女生节目成功后，催生了一大批的跟风者
high	Excited, do something to one's heart's content 你听听这段音乐，肯定让你感觉特别-
F1	Integrated circuit card
IC卡	Trendy, fashionable
IP卡	Internet phone card
N多	A lot of, many times 这道教学太难了，我多做了-，也没有结果
