index	sequence_index	section	thai	phonetic	register	definition	note	custom-note
2920	20	146	มันเปลืองเงิน	man bplʉang ngən		It’s a waste of money. / That’s a waste of money.		
2921	1	147	ยิงปืนนัดเดียวได้นกสองตัว	ying bpʉʉn nát diao dâi nók sɔ̌ɔng dtua	IDIOM	Kill two birds with one stone.		
2922	2	147	เขาโดนใส่ความ	kǎo doon sài-kwaam		He was framed. / He was set up. / He was falsely blamed.		
2923	3	147	ยังเด็กเกินกว่าที่จะเข้าใจ	yang dèk gəən-gwàa tîi-jà kâo-jai (		She) was (still) too young to understand.		
2924	4	147	เรา(มัน)คนละระดับกัน	rao (man)		kon-lá rá-dàp gan We’re not in the same class. / We’re of a different class/level./(of social standing or wealth)		
2925	5	147	(มี)นามว่า(การะเกด)	(mii) naam wâa (gaa-rá-gèet)	LITERARY	She was named “‘Karaket’. / Her name is ‘Karaket’.		
2926	6	147	กำลังตกอยู่ในอันตราย	gam-lang dtòk-yùu-nai-an-dtà-raai (	SEMI-LITERARY	He)’s in danger. / (He)’s fallen into trouble.		
2927	7	147	ฉันทำได้ทุกอย่างเพื่อ(ลูก)	chǎn tam dâi túk-yàang pʉ̂a (lûuk)		I’d do anything for (my kids).		
2928	8	147	ไม่หลาบจำ	mâi làap-jam (	SEMI-LITERARY	He) hasn’t learned his lesson. / (He)’s incorrigible.		
2929	9	147	เท่าที่ฟังมา	... tâo-tîi fang maa...		From what I hear… / From what I’ve heard… / As far as I’ve heard…		
2930	10	147	เขาได้รับผลกระทบจาก	...  kǎo dâi-ráp pǒn-grà-tóp jàak...	FORMAL	He was affected by… / He was hit by…		
2931	11	147	มันทำให้ฉันได้รู้ว่า	... man tam-hâi chǎn dâi-rúu wâa...		It made me realize...		
2932	12	147	เป็นบุญของผมที่	...  bpen-bun kɔ̌ɔng pǒm tîi...	LITERARY	I’m fortunate to… / I’m lucky that… / I’m blessed to…		
2933	13	147	ฉันรอ(คอย)วันนี้มานาน	chǎn rɔɔ (kɔɔi) wan-níi maa naan		I’ve been waiting for this day for a long time. / I’ve waited for this day for ages.		
2934	14	147	อาจพิการตลอดชีวิต	àat pí-gaan dtà-lɔ̀ɔt-chii-wít (		He) might be crippled/handicapped for the rest of (his) life.		
2935	15	147	(มัน)เป็นเรื่องที่น่าเสียดายมาก	(man) bpen rʉ̂ang tîi nâa-sǐa-daai mâak		It’s really a pity. / It’s really unfortunate.		
2936	16	147	รถเสียหลัก	rót sǐa-làk		The car lost control.		
2937	17	147	ลืมไม่ลงเลย	lʉʉm mâi-long ləəi	SEMI-LITERARY	I can’t forget. / It’s unforgettable.		
2938	18	147	มอบตัวเถอะ	mɔ̂ɔp-dtua tə̀		Turn yourself in! / Surrender!		
2939	19	147	(หล่อ)เหมือน(พ่อ)ไม่มีผิด	(lɔ̀ɔ) mʉ̌an (pɔ̂ɔ) mâi-mii-pìt (		Handsome) just like (his father)!		
2940	20	147	ไปดีมาดี	bpai dii maa dii		Bon voyage. / Have a safe trip.		
2941	1	148	ให้ผมไปส่งนะ	hâi pǒm bpai sòng ná		Let me give you a ride. / I’ll walk you there.		
2942	2	148	ยังจำได้	yang jam dâi		(I) still remember it. / (I) still remember him. / (I) still remember.		
2943	3	148	มันไม่สำคัญ	man mâi sǎm-kan		It’s not important.		
2944	4	148	มาที่นี่ได้ยังไง	maa tîi-nîi dâi yang-ngai		What are you doing here?! / How did you get here?!		
2945	5	148	ผมมีข้อเสนอให้คุณ	pǒm mii kɔ̂ɔ-sà-nə̌ə hâi kun		I have a proposition/proposal/suggestion for you.		
2946	6	148	อย่าเพิ่งเปิด	yàa pə̂ng bpə̀ət		Don’t open it! / Don’t open it yet!		
2947	7	148	โทษที	tôot tii	INFORMAL	Sorry. / Excuse me.		
2948	8	148	ยังไม่กล้าพอ	yang mâi glâa pɔɔ		I don’t have the courage (yet). / I don’t have the guts (to…)		
2949	9	148	ล้อเล่นใช่มั้ย	lɔ́ɔ-lên châi-mái		You’re joking, right? / Are you kidding me?		
2950	10	148	ครั้งที่แล้ว	... kráng-tîi-lɛ́ɛo...		(The) last time…		
2951	11	148	ถ้าทำอย่างนั้น	... tâa tam yàang-nán...		If you did that… / If he does that… / If you do…		
2952	12	148	จะย้ายไปไหน	jà yáai bpai nǎi		Where are you moving to?		
2953	13	148	ไม่ค่อยชอบคนเยอะ	mâi-kɔ̂i chɔ̂ɔp kon yə́		(I) don’t like crowds. / (I) don’t like crowded places.		
2954	14	148	อาจจะนานไป(หน่อย)	àat-jà naan bpai (nɔ̀i)		It might be (a bit) too long. (to wait, to do something, etc.)		
2955	15	148	ทำไมไม่ตอบ	tam-mai mâi dtɔ̀ɔp		Why don’t you answer (me)? / Why aren’t you answering?		
2956	16	148	ไปนอนพักผ่อน	bpai nɔɔn pák-pɔ̀n		Get some rest. / Lie down and get some rest.		
2957	17	148	คุณน่าจะดีใจ	kun nâa-jà dii-jai		You outta be happy. / You should be glad.		
2958	18	148	คล้ายกันมาก	kláai-gan mâak		(They)’re very similar! / So similar!		
2959	19	148	ดีขึ้นหรือยัง	dii-kʉ̂n rʉ̌ʉ-yang		Are you better yet? / Are you feeling better?		
2960	20	148	ห้ามบอกใคร	hâam bɔ̀ɔk krai		Don’t tell anyone! / You’re not allowed to tell anybody.		
2961	1	149	ใครโทรมา	krai too-maa		Who’s calling (me)? / Who called?		
2962	2	149	บอกไม่ถูก	bɔ̀ɔk-mâi-tùuk		I can’t explain. / It’s difficult to say.		
2963	3	149	เราเพิ่งรู้จักกัน	rao pə̂ng rúu-jàk-gan		We just met. / We’ve only just met.		
2964	4	149	ไม่เอาอีกแล้ว	mâi-ao ìik-lɛ́ɛo		I don’t want (that) any more! / Never again!		
2965	5	149	เงยหน้าขึ้น	ngəəi-nâa kʉ̂n		Look up. / Raise up your head. / Lift your head (up).		
2966	6	149	แค่นี้เองเหรอ	kɛ̂ɛ níi eeng rə̌ə		That’s it? / Is that all? / Is that all there is?		
2967	7	149	อยากจะรู้เหมือนกัน	yàak já rúu mʉ̌an-gan (		I) wanna know too. / (I) want to know that as well.		
2968	8	149	เขาเป็นคนขี้อวด	kǎo bpen kon kîi-ùat		He’s a braggart. / He likes to brag. / She likes to show off.		
2969	9	149	ไม่เคยสำเร็จ	mâi-kəəi sǎm-rèt		He was never successful. / She never pulled it off. / It’s never been done (successfully).		
2970	10	149	ไม่ว่าคุณจะเป็นใคร	mâi-wâa kun jà bpen krai		No matter who you are…		
2971	11	149	เราพบกันครั้งแรกที่	... rao póp gan kráng-rɛ̂ɛk tîi...		We first met at. / We met each other for the first time at…		
2972	12	149	บอกผมได้ไหม(ว่า... )	bɔ̀ɔk pǒm dâi-mǎi (wâa...)		Can you tell me (…)?		
2973	13	149	รอนานไหมคะ	rɔɔ naan mǎi ká		Have you been waiting long? / Did you wait a long time?		
2974	14	149	อย่าลืมที่(ฉัน)บอกนะ	yàa lʉʉm tîi (chǎn) bɔ̀ɔk ná		Don’t forget what I told you.		
2975	15	149	ไม่เคยรู้จักเขา(มาก่อน)	mâi-kəəi rúu-jàk kǎo (maa-gɔ̀ɔn) (		I)’ve never met him before.		
2976	16	149	ผมรู้ความจริงแล้ว	pǒm rúu kwaam-jing lɛ́ɛo		I know the truth. / Now I know the truth.		
2977	17	149	ไม่กินเผ็ด	mâi gin pèt		(I) don’t eat spicy food. / I can’t eat spicy food.		
2978	18	149	ชอบกินอาหารรสจัด	chɔ̂ɔp gin aa-hǎan rót-jàt (		I) like spicy food. / (I) like heavily seasoned food.		
2979	19	149	มันจืดไปหน่อย	man jʉ̀ʉt bpai nɔ̀i		It’s a bit bland. / It’s lacking flavor.		
2980	20	149	รักเสมอมา	rák sà-mə̌ə maa		I’ve always loved you.		
2981	1	150	ทำไมต้องโกรธขนาดนั้น	tam-mai dtɔ̂ng gròot kà-nàat nán		Why do you have to get so angry?		
2982	2	150	เป็นโอกาสทอง	bpen oo-gàat tɔɔng		It’s the perfect chance. / It’s a golden opportunity.		
2983	3	150	ต้องมีวิธีที่ดีกว่า	dtɔ̂ng mii wí-tii dii gwàa		There must be a better way.		
2984	4	150	กลับเองได้	glàp eeng dâi		I can go back by myself. / I can go back alone.		
2985	5	150	มีคนมาถามหาคุณ	mii kon maa tǎam-hǎa kun		There was (a guy) here asking about you. / A (guy) came here asking about you.		
2986	6	150	ได้ทำในสิ่งที่อยากทำ	dâi tam nai sìng tîi yàak tam (		I) got to do what I wanted (to do). / I was able to do things which I had wanted to do.		
2987	7	150	(พอจะ)รู้จักคนชื่อ... ไหม(ครับ)	(pɔɔ jà) rúu-jàk kon chʉ̂ʉ... mǎi (kráp)		Do you know someone named… ?		
2988	8	150	ผมตั้งใจจะพูดว่า	... pǒm dtâng-jai jà pûut wâa...		I meant to say… / I intended to say…		
2989	9	150	หน้าด้าน	nâa-dâan	STRONG	How dare you! / You have no shame! / You’re shameless!		
2990	10	150	กินยาก็ไม่หาย	gin yaa gɔ̂ɔ mâi hǎai		(I) took (the) medicine but it/I didn’t get (any) better.		
2991	11	150	ไม่แข่งกับใคร	mâi kèng gàp krai		(I)’m not competing with anyone.		
2992	12	150	ใกล้แค่นี้เอง	glâi kɛ̂ɛ-níi eeng		It’s right here. / It’s very close. / It’s just around the corner.		
2993	13	150	ได้พักผ่อนเต็มที่	dâi pák-pɔ̀n dtem-tîi (		I) got a really good rest. / (I) was able to get a really good break.		
2994	14	150	แม้แต่คำเดียว	mɛ́ɛ-dtɛ̀ɛ kam diao		Not a single word. / Not a single bite.		
2995	15	150	ฉันยังไม่แก่ขนาดนั้น	chǎn yang mâi gɛ̀ɛ kà-nàat-nán		I’m not that old!		
2996	16	150	ความรักอย่างเดียว(มัน)ไม่พอ	kwaam-rák yàang-diao (man) mâi-pɔɔ		Love alone isn’t enough.		
2997	17	150	ผมเป็นคนเสนอเอง	pǒm bpen kon sà-nə̌ə eeng		I was the one who suggested it.		
2998	18	150	มีรอยขีดข่วน	mii rɔɔi-kìit-kùan		It’s scratched. / It’s got a scratch.		
2999	19	150	ทำไมขี้ลืมขนาดนี้	tam-mai kîi-lʉʉm kà-nàat-níi		Why am (I) so forgetful?!		
3000	20	150	ปฏิเสธได้ยังไง	bpà-dtì-sèet dâi yang-ngai		How could (he) refuse?		
3001	1	151	ทำไมต้องโกหก(ฉัน)	tam-mai dtɔ̂ng goo-hòk (chǎn)		Why do you have to lie (to me)?		
3002	2	151	ผมว่าไม่น่านะ(ครับ)	pǒm wâa mâi-nâa ná (kráp)		I don’t think so. / I doubt it.		
3003	3	151	พี่จะซื้อให้ใหม่	pîi jà sʉ́ʉ hâi mài		I’ll buy you a new one.		
3004	4	151	เป็น(โรงเรียน)ที่มีชื่อเสียง	bpen (roong-rian) tîi mii-chʉ̂ʉ-sǐang		It’s a (famous/well-known/reputable) school.		
3005	5	151	(ก็)พอได้	(gɔ̂ɔ) pɔɔ-dâi	INFORMAL	Not bad. / Okay. / Passable.		
3006	6	151	อีกนิดเดียวจะเสร็จ	ìik nít-diao jà sèt (		I)’ll be done in a bit. / (I)’ll be finished in short while.		
3007	7	151	ฉันคิดถูกแล้ว	chǎn kít tùuk lɛ́ɛo		I was right. (about what I thought)		
3008	8	151	มันแพงมาก	man pɛɛng mâak		(It)’s so expensive! / (That) was so expensive!		
3009	9	151	กินยาหรือยัง	gin yaa rʉ̌ʉ-yang		Did you take (any) medicine (yet)? / Have you taken your medicine yet?		
3010	10	151	ฝุ่น(มัน)เยอะ / มีฝุ่นเยอะ	fùn (man) yə́ / mii fùn yə́		It’s dusty. / There’s a lot of dust.		
3011	11	151	ไม่ได้เป็นอะไร	mâi-dâi bpen-à-rai		I’m fine. / Nothing’s wrong with me.		
3012	12	151	แดด(มัน)ร้อน	dɛ̀ɛt (man) rɔ́ɔn		The sun’s very hot. / It’s very hot.		
3013	13	151	ฟังก่อน	fang gɔ̀ɔn	STRONG	Listen! / Listen to me!		
3014	14	151	ไม่อยากโกหก	mâi-yàak goo-hòk		I don’t wanna lie (to you).		
3015	15	151	ผมได้ยินเสียงร้อง	pǒm dâi-yin sǐang-rɔ́ɔng		I heard screaming. / I heard a scream.		
3016	16	151	เห็นนี้หรือยัง	hěn níi rʉ̌ʉ-yang		Have (you) seen this (yet)?		
3017	17	151	ผมได้กลิ่นควัน	pǒm dâi-glìn kwan		I smell smoke.		
3018	18	151	อย่าประมาท	yàa bprà-màat		Don’t be careless.		
3019	19	151	อย่าพูดอย่างนั้น(สิ) / อย่าพูดแบบนั้น(สิ)	yàa pûut yàang-nán (sì) / yàa pûut bɛ̀ɛp-nán (sì)		Don’t say that! / Don’t talk that way!		
3020	20	151	เขาเป็นสุภาพบุรุษ	kǎo bpen sù-pâap-bù-rùt		He’s a gentleman.		
3021	1	152	นั่งที่ไหนดี	nâng tîi-nǎi dii		Where shall we sit? / Where do you wanna sit?		
3022	2	152	ทำไมกลับเร็วจัง	tam-mai glàp reo jang		Why are you back so soon? / Why are you home so early? OR You’re leaving so soon?		
3023	3	152	มีทางเดียว	mii taang-diao		There’s only one way.		
3024	4	152	มันไม่ปลอดภัย	man mâi bplɔ̀ɔt-pai		It’s not safe.		
3025	5	152	รางวัลที่ (1)	raang-wan tîi (nʉ̀ng) (		First) prize.		
3026	6	152	ปวดตา	bpùat dtaa		(My) eyes hurt. / (My) eyes are tired.		
3027	7	152	ไม่เหงาเหรอ	mâi ngǎo rə̌ə		Aren’t you lonely? / Don’t you get lonely?		
3028	8	152	อย่าไปพูดถึง	... yàa bpai pûut-tʉ̌ng...		Don’t talk about… ! / Don’t mention… !		
3029	9	152	ตอนที่คุณไม่อยู่	... dtɔɔn-tîi kun mâi-yùu…		When you were gone… / While you were gone… / When you were away…		
3030	10	152	…ถ้าจำเป็นจริงๆ	...tâa jam-bpen jing-jing		…if it’s really necessary. / …if you really need to.		
3031	11	152	มันจำเป็นจริงๆ	man jam-bpen jing-jing		It’s really necessary. / It’s absolutely necessary. / I really must.		
3032	12	152	น่าจะพอ	nâa-jà pɔɔ		It should be enough. / That should suffice.		
3033	13	152	นี้ไง	níi ngai		Here it is! (I found it.)		
3034	14	152	จะไปทำไม	jà bpai tam-mai		Why are you going to go (there)? / Why are you going?		
3035	15	152	เขาจะคิดยังไง	kǎo jà kít yang-ngai		What will she think (about it)?		
3036	16	152	ผมจะไปเยี่ยมคุณ	pǒm jà bpai yîam kun		I’ll visit you. / I’ll come visit you.		
3037	17	152	ทำไม่ยาก	tam mâi yaak		It’s not hard to make.		
3038	18	152	ฉันอยากตาย	chǎn yàak dtaai		I wanna die!		
3039	19	152	ต้องทำงานหนัก	dtɔ̂ng tam-ngaan nàk		I have to work hard. / He had to work hard.		
3040	20	152	ไม่รู้จะขอบคุณยังไง	mâi-rúu jà kɔ̀ɔp-kun yang-ngai		I don’t know how to thank you.		
3041	1	153	ทำอะไรบ้างวันนี้	tam à-rai bâang wan-níi		What did you do today? / What did you make today?		
3042	2	153	เขางก / เขาเป็นคนขี้งก	kǎo ngók / kǎo bpen kon kîi-ngók		He’s stingy. / He’s greedy. / He’s a cheapskate.		
3043	3	153	เขาออกไปข้างนอก	kǎo ɔ̀ɔk-bpai kâang-nɔ̂ɔk		She went out. / She went outside.		
3044	4	153	ฉันดีใจกับแกนะ	chǎn dii-jai-gàp gɛɛ ná		I’m happy for you.		
3045	5	153	ท้อง(ฉัน)ร้อง	tɔ́ɔng (chǎn) rɔ́ɔng		My stomach is growling! (hungry)		
3046	6	153	จำได้ทุกคำ	jam dâi túk kam		(I) remember every word.		
3047	7	153	เราเป็นแค่เพื่อน	rao bpen kɛ̂ɛ pʉ̂an		We’re just friends. / We’re only friends.		
3048	8	153	ใครบอกว่า	... krai bɔ̀ɔk wâa...		Who says…? / Who said…?		
3049	9	153	ไม่ได้กินนาน	mâi-dâi gin naan		I haven’t had (that) for a long time. / It’s been awhile since I ate (that).		
3050	10	153	ผมไม่มีคนอื่น	pǒm mâi-mii kon-ʉ̀ʉn		I don’t have anyone else. / I have no one else. (but you/her)		
3051	11	153	ถอดรองเท้าด้วย(ครับ)	tɔ̀ɔt rɔɔng-táao dûai (kráp)		Please take off your shoes.		
3052	12	153	มันน่าตื่นเต้น	man nâa-dtʉ̀ʉn-dtên		It’s exciting.		
3053	13	153	ยังไม่อยากมี	yang mâi-yàak mii		(I) don’t want one yet.		
3054	14	153	ขายไม่ค่อยดี	kǎai mai-kɔ̂i dii		(They’re) not selling very well. / (It’s) not selling so well.		
3055	15	153	เล่ามาสิ	lâo maa sì	INFORMAL	Tell me! / Tell me about it!		
3056	16	153	เชิญใหม่นะครับ / นะคะ	chəən mài ná-kráp / ná-ká		Please come again.		
3057	17	153	อยากออกไปเดินเล่น	yàak ɔ̀ɔk-bpai dəən-lên		(I) wanna go out for a walk. / I want to take a stroll.		
3058	18	153	มันบาปนะ	man bpàap ná		It’s a sin. / That’s a sin.		
3059	19	153	ฉันจำเป็นต้องรู้	chǎn jam-bpen-dtɔ̂ng rúu		I have to know. / It’s necessary that I know.		
3060	20	153	พูดอะไรก็ได้	pûut à-rai gɔ̂ɔ-dâi		Say whatever you want (to say). / Say anything.		
3061	1	154	(มัน)อาจไม่ใช่ความจริงทั้งหมด	(man) àat mâi-châi kwaam-jing táng-mòt (		It) might not all be true. / All of it may not be the truth.		
3062	2	154	จะแย่ยิ่งกว่านี้	jà yɛ̂ɛ yîng-gwàa níi		It could have been worse. / I could be worse.		
3063	3	154	ไม่ได้รับการติดต่อกลับ(มาเลย)	mâi-dâi ráp gaan-dtìt-dtɔ̀ɔ	FORMAL	glàp (maa ləəi)/(I) didn’t receive any response. / (I) never got an answer back.		
3064	4	154	(ท่าทาง)มีพิรุธ	(tâa-taang) mii-pí-rút		He’s acting suspicious. / Something’s fishy about the way she’s behaving. / She’s acting strange. (suspicious)		
3065	5	154	มันอันตรายถึงชีวิต	man an-dtà-raai tʉ̌ng chii-wít		It’s lethal. / It’s life-threatening. / It can be fatal.		
3066	6	154	ความพยายามอยู่ที่ไหน ความสำเร็จอยู่ที่นั่น	kwaam-pá-yaa-yaam yùu-tîi-nǎi kwaam-sǎm-rèt yùu-tîi-nân		Where there’s a will, there’s a way! / If you try hard, you’ll surely succeed!		
3067	7	154	ฝากไว้ให้คิด	fàak wái hâi kít		Food for thought. / Something to think about.		
3068	8	154	โคตรสะใจ(เลยว่ะ)	kôot sà-jai (ləəi) wâ (		I)’m soooo satisfied! / So fuckin’ satisfying!		
3069	9	154	(และ)เมื่อถึงวันนั้น	lɛ́ mʉ̂a tʉ̌ng wan-nán (	LITERARY	And) when that day comes…		
3070	10	154	(เธอเป็นนางเอก)ขวัญใจของ(ผม)	təə bpen naang-èek) kwǎn-jai kɔ̌ɔng (pǒm	LITERARY	(She)’s (my) favorite actress. / (She)’s (my) beloved actress.		
3071	11	154	ต้องมีระเบียบวินัย	dtɔ̂ng mii rá-bìap-wí-nai	FORMAL	(You) need to be disciplined. / (You) have to have discipline.		
3072	12	154	ทําทุกวิถีทางเพื่อ(แก้ไขปัญหา)	tam túk wí-tii-taang pʉ̂a (gɛ̂ɛ-kǎi bpan-hǎa) (		They) tried everything possible to (fix the problem). / (He) did everything he could to (fix the problem).		
3073	13	154	เรากลับไปแก้ไขอะไรไม่ได้(แล้ว)	rao glàp bpai gɛ̂ɛ-kǎi à-rai mâi-dâi (lɛ́ɛo)		We cannot undo what has been done. / We cannot change anything. (it’s done and in the past)		
3074	14	154	ไปไม่ถึง(บ้าน)	bpai mâi-tʉ̌ng (bâan) (		He) didn’t make it (home). / (He) didn’t reach (his home).		
3075	15	154	ผมมีปัญหามากพออยู่แล้ว	pom mii bpan-hǎa mâak pɔɔ yùu lɛ́ɛo		I have enough troubles of my own. / I have enough problems already.		
3076	16	154	ตายคาที่	dtaai kaa-tii		(He) died on the spot. / (He) died instantaneously. / (He) died at the scene of the accident.		
3077	17	154	เรารู้จักกัน(มา)ตั้งแต่ยังเป็นเด็ก	rao rúu-jàk gan (maa) dtâng-dtɛ̀ɛ yang bpen dèk		We’ve known each other since we were kids.		
3078	18	154	ตามหามันให้เจอ	dtaam-hǎa man hâi jəə	STRONG	Find him! / Go find him! (follow him and find him)		
3079	19	154	อย่าโยนความผิดให้คนอื่น	yàa yoon-kwaam-pìt-hâi kon-ʉ̀ʉn		Don’t blame others. / Don’t put the blame on others. / Stop blaming others.		
3080	20	154	พูดเองเออเอง	pûut eeng əə eeng		Speak for yourself! / You said it, not me!		
3081	1	155	ทำไมจะไม่ได้	tam-mai jà mâi-dâi		Why CAN’T you?! / Why not?!		
3082	2	155	ไม่มีใครพิสูจน์ได้	mâi-mii-krai pí-sùut dâi		No one can prove it. / You can’t prove it. / No one could prove it.		
3083	3	155	เล่าให้(ฉัน)ฟังก็ได้นะ	lâo hâi (chǎn) fang gɔ̂ɔ-dâi ná (		You) can tell me (about it).		
3084	4	155	เป็นอะไรตาย	bpen-à-rai dtaai	INFORMAL	What did he die of? / What did he die from?		
3085	5	155	(มัน)มีอยู่จริง	(man) mii-yùu jing (		It) (really) does exist. / (It)’s real.		
3086	6	155	มันเกิดขึ้นเร็วมาก	man gə̀ət-kʉ̂n reo mâak		It happened so fast.		
3087	7	155	ผมไม่มีอะไรจะคุย	pǒm mâi-mii-à-rai jà kui		I have nothing to say.		
3088	8	155	ไม่น่าเป็นห่วง	mâi-nâa bpen-hùang		There’s nothing to worry about. / No need to worry (about it).		
3089	9	155	อย่าไปใส่ใจเลย	yàa bpai sài-jai ləəi		Don’t pay (it) any attention. / Don’t worry about it. / Just let it go.		
3090	10	155	ตามธรรมเนียม(จีน)(...)	dtaam-tam-nian (jiin) (...)		It’s a (Chinese) tradition. / According to (Chinese) tradition (…) / Following (Chinese) custom (…)		
3091	11	155	ต้องมีอะไรบางอย่าง	... dtɔ̂ng mii-à-rai baang-yàang...		There must be something… / There’s gotta be something…		
3092	12	155	คุณจะไม่ผิดหวัง(อย่างแน่นอน)	kun jà mâi pìt-wǎng (yàang-nɛ̂ɛ-nɔɔn)		You (surely) won’t be disappointed.		
3093	13	155	เข้าท่า(ดี)	kâo-tâa (dii)		Good idea! / Sounds good!		
3094	14	155	เวลาเป็นเงิน(เป็นทอง)	wee-laa bpen ngən (bpen-tɔɔng)		Time is money.		
3095	15	155	ขอโทษเรื่องอะไร	kɔ̌ɔ-tôot rʉ̂ang à-rai		What are you sorry for?		
3096	16	155	ขอโทษอะไรกัน	kɔ̌ɔ-tôot à-rai gan		Sorry for what?!		
3097	17	155	ทุกปัญหามีทางออก(เสมอ)	túk bpan-hǎa mii taang-ɔ̀ɔk (sà-mə̌ə)	SEMI-LITERARY	Every problem has a solution.		
3098	18	155	ไม่ต้องพึ่งพาใคร	mâi-dtɔ̂ng pʉ̂ng-paa krai (		You) don’t need to depend on anyone. / You can be independent.		
3099	19	155	เขาเป็นคนบอกผมเอง	kǎo bpen kon bɔ̀ɔk pǒm eeng		He’s the one who told me. / He told me himself.		
3100	20	155	เราสอบไม่ติด	rao sɔ̀ɔp mâi-dtìt		I didn’t pass. / I didn’t pass the test.		
3101	1	156	ฉันรู้เรื่องแล้ว	chǎn rúu-rʉ̂ang lɛ́ɛo		I know about it. / I know about… / I know.		
3102	2	156	ผมเสียใจกับเรื่องที่เกิดขึ้น	pǒm sǐa-jai gàp rʉ̂ang tîi gə̀ət-kʉ̂n		I’m sorry for what (has) happened.		
3103	3	156	ฉันโกหกตัวเองไม่ได้	chǎn goo-hòk dtua-eeng mâi-dâi		I can’t lie to myself.		
3104	4	156	ผมเบื่อที่จะต้อง(รอ)	pǒm bʉ̀a tîi jà dtɔ̂ng (rɔɔ)		I’m tired of (waiting). / I’m tired of having to (wait).		
3105	5	156	พูดอะไรอย่างนั้น	pûut à-rai yàang-nán		Why do you say that?! / What are you talking about?!		
3106	6	156	เราไม่ได้แข่งกับใคร(เลย)	rao mâi-dâi kɛ̀ng gàp krai (ləəi)		We’re not competing with anyone.		
