index	sequence_index	section	thai	phonetic	register	definition	note	custom-note
1046	6	53	อยู่ตรงนี้ไง	yùu dtrong-níi ngai		(It)’s right here.		
1047	7	53	ท้อง(ฉัน)ร้อง	tɔ́ɔng (chǎn) rɔ́ɔng		My stomach is growling. (I’m hungry.)		
1048	8	53	(นั่ง)กินเป็นเพื่อนหน่อย	(nâng) gin bpen-pʉ̂an nɔ̀i (		Sit down and) have something to eat with me.		
1049	9	53	คุณทำผมตกใจ	kun tam pǒm dtòk-jai		You scared me. / You startled me.		
1050	10	53	มันผิดกฎหมาย	man pìt-gòt-mǎai		It’s illegal. / It’s against the law.		
1051	11	53	เป็นเรื่องธรรมชาติ	bpen rʉ̂ang tam-má-châat		It’s (perfectly/completely) natural.		
1052	12	53	ผมไม่ได้ตั้งใจ	pǒm mâi-dâi dtâng-jai		I didn’t mean to. / That wasn’t my intention.		
1053	13	53	(…)คงไม่เป็นไร (...)	kong mâi-bpen-rai		It will be okay. / He will be all right.		
1054	14	53	เขาไม่เคยบอกผม	kǎo mâi-kəəi bɔ̀ɔk pǒm		He never told me. / She’s never told me.		
1055	15	53	ยอดไปเลย	yɔ̂ɔt bpai ləəi		That’s great/fantastic/awesome/wonderful!		
1056	16	53	ไม่ใช่อย่างนั่น	mâi-châi yàang-nân		It’s not like that! / That’s not it! / That’s not why!		
1057	17	53	ไม่ใช่เรื่องใหญ่	mâi-châi rʉ̂ang-yài		It’s no big deal. / No biggie.		
1058	18	53	อดทนไว้	òt-ton wái		Hang on! / Be patient. / Hang in there.		
1059	19	53	ไม่ใช่สเปคผม	mâi-châi sà-bpék pǒm		(She)’s not my type.		
1060	20	53	ฉันลืมถามว่า	... chǎn lʉʉm tǎam wâa...		I forgot to ask…		
1061	1	54	เป็นบ้าอะไรของคุณ	bpen bâa à-rai kɔ̌ɔng kun		What the hell’s wrong with you?! / What on earth is wrong with you?!		
1062	2	54	อยากทำอะไรก็เชิญ	yàak tam à-rai gɔ̂ɔ chəən (		Go ahead) Do whatever you want.		
1063	3	54	อย่าทำให้เป็นเรื่อง(ใหญ่)	yàa tam-hâi bpen rʉ̂ang (yài)		Don’t make a big deal of it. / Don’t make a scene.		
1064	4	54	ในพริบตา	nai-príp-dtaa		in a blink of an eye / in an instant		
1065	5	54	เท่าที่ทราบ/รู้	... tâo-tîi sâap/rúu...		As far as I know…		
1066	6	54	แต่พอคิดอีกที	... dtɛ̀ɛ pɔɔ kít ìik tii...		But on second thought…		
1067	7	54	ฉันต้องสารภาพ(ว่า... )	chǎn dtɔ̂ng sǎa-rá-pâap (wâa...)		I must confess (that…)		
1068	8	54	…ตั้งแต่จำความได้	... ...dtâng-dtɛ̀ɛ jam-kwaam dâi...		Ever since I can remember... / …for as long as I can remember.		
1069	9	54	...ไม่ช้าก็เร็ว	... ...mâi-cháa-gɔ̂ɔ-reo...		…sooner or later…		
1070	10	54	ผมมีสิทธิ์ที่จะ(รู้)	pǒm mii-sìt tîi jà (rúu)		I have a right to (know).		
1071	11	54	กรุณากรอกแบบฟอร์มนี้	gà-rú-naa grɔ̀ɔk bɛ̀ɛp-fɔɔm níi	FORMAL	Please fill out this form.		
1072	12	54	วันเกิดอายุ(ครบ) (60) ปี	wan-gə̀ət aa-yú (króp) (hòk-sìp) bpii (60th) birthday				
1073	13	54	(ยัง)มีอีกเพียบ	(yang) mii ìik pîap		There’s plenty more. / We have plenty more.		
1074	14	54	ไม่มีใครได้รับบาดเจ็บ	mâi-mii krai dâi-ráp bàat-jèp		No one was injured/hurt.		
1075	15	54	ไม่มีอำนาจ	...  mâi-mii am-nâat (	SEMI-FORMAL	He) doesn’t have the authority/power (to)…		
1076	16	54	ขอโทษที่ทำให้เดือดร้อน	kɔ̌ɔ-tôot tîi tam-hâi dʉ̀at-rɔ́ɔn		I’m sorry for the trouble I’ve caused you.		
1077	17	54	มาถึงจนได้	maa-tʉ̌ng jon-dâi		We made it! / We finally arrived! / It finally arrived.		
1078	18	54	ไม่ว่าอะไรจะเกิดขึ้น	... mâi-wâa à-rai jà gə̀ət-kʉ̂n…		No matter what happens… / Whatever happens…		
1079	19	54	ไม่มีที่ติ	mâi-mii tîi-dtì		It’s flawless. / It’s perfect.		
1080	20	54	ยิ่ง(แย่)เข้าไปใหญ่	yîng (yɛ̂ɛ) kâo-bpai yài		It’s even (worse). / That makes it all the (worse).		
1081	1	55	เอาเลย	ao ləəi		Come on. / Go on. (do it)		
1082	2	55	อย่าดื้อ(สิ)	yàa dtʉ̂ʉ (sì)		Don’t be (so) stubborn!		
1083	3	55	มองไม่เห็น	mɔɔng-mâi-hěn		I can’t see (it).		
1084	4	55	มันไม่ใช่ความรัก	man mâi-châi kwaam-rák		It’s not love. / That’s not love.		
1085	5	55	อย่าบอกนะว่า	... yàa bɔ̀ɔk ná wâa...		Don’t tell me…		
1086	6	55	ห้ามแตะต้อง(... )	hâam dtɛ̀-dtɔ̂ng(...)		Don’t touch (…) (contact or touch)		
1087	7	55	ไม่รอแล้ว	mâi-rɔɔ lɛ́ɛo		(I)’m not waiting. / (I) can’t wait anymore.		
1088	8	55	มันก็พูดยากนะ	man gɔ̂ɔ pûut yâak ná		It’s hard/difficult to say.		
1089	9	55	ก็ใช่นะสิ	gɔ̂ɔ châi ná sì		Yeah (it is!/you are!). / Of course. / Exactly.		
1090	10	55	กลับไปพักผ่อน	glàp bpai pák-pɔ̀n		Go back (home) and get some rest.		
1091	11	55	เขาเป็นโรคจิต	kǎo bpen rôok-jìt		He’s mentally ill. / He’s psycho. / She has mental problems.		
1092	12	55	ไปทางไหนดี	bpai taang-nǎi dii		Which way should I go? / Which way?		
1093	13	55	ไม่มีสมาธิ	mâi-mii sà-maa-tí		(I) can’t concentrate. / (I) can’t focus/ (I) get distracted.		
1094	14	55	ไปหาอะไรกินกัน	bpai hǎa à-rai gin gan		Let’s grab a bite to eat. / Let’s go find something to eat. / Let’s go get something to eat.		
1095	15	55	พรุ่งนี้มีสอบ	prûng-níi mii sɔ̀ɔp		We have a test tomorrow. / There’s a test tomorrow.		
1096	16	55	คุณอยากรู้ไปทำไม	kun yàak rúu bpai tam-mai	SOMEWHAT STRONG	Why do you wanna know?		
1097	17	55	ดูธรรมชาติ	duu tam-má-châat		It looks natural.		
1098	18	55	อย่าเถียง	yàa tǐang		Don’t argue (with me)!		
1099	19	55	ทำไมไม่เชื่อฉัน	tam-mai mâi-chʉ̂a chǎn		Why don’t you believe me?		
1100	20	55	ใจร้ายจัง	jai-ráai jang		You’re so mean/cruel/wicked!		
1101	1	56	ทำใจให้สบาย	tam-jai hâi sà-baai		Relax. / Chill out. / Don’t worry about it. / Take it easy.		
1102	2	56	(แก)พูดเกินไป	(gɛɛ) pûut gəən-bpai (		You)’re exaggerating! / That’s a bit too much!		
1103	3	56	มีอะไรกินบ้าง	mii à-rai gin bâang		What’s there eat? / What do we have to eat?		
1104	4	56	จะพาฉันไปไหน	jaà paa chǎn bpai-nǎi		Where are you taking me?		
1105	5	56	ได้เลย	dâi ləəi		Sure! / Okay! / All right! (agreeing to something)		
1106	6	56	เพราะอะไรรู้มั้ย	prɔ́-à-rai rúu-mái	INFORMAL	You know why? / Do you know why?		
1107	7	56	อาจ(จะ)เป็นอุบัติเหตุ	àat (jà) bpen ù-bàt-dtì-hèet		Maybe it was an accident.		
1108	8	56	ได้ครบแล้ว	dâi króp lɛ́ɛo		(I) have everything. / (They) got it all.		
1109	9	56	ขอโทษที่ทำให้เสียเวลา	kɔ̌ɔ-tôot tîi tam-hâi sǐa-wee-laa		Sorry for wasting your time.		
1110	10	56	เปิดประตู(หน่อย)(สิ)	bpə̀ət bprà-dtuu (nɔ̀i) (sì)		Open the door.		
1111	11	56	เราเป็นเพื่อนสนิทกัน	rao bpen pʉ̂an sà-nìt gan		We’re close friends. / We’re best friends.		
1112	12	56	จะพิสูจน์ให้ดู	jà pí-sùut hâi duu		(I)’ll prove it to you.		
1113	13	56	อย่าไปไหน(นะ)	yàa bpai-nǎi (ná)		Don’t go anywhere.		
1114	14	56	มันไม่ยุติธรรม	man mâi-yùt-dtì-tam		It’s not fair.		
1115	15	56	มันเป็นทางตัน	man bpen taang-dtan		It’s a dead end.		
1116	16	56	ผมไม่อยากอยู่คนเดียว	pǒm mâi-yàak yùu kon-diao		I wanna be alone.		
1117	17	56	มากไปแล้ว	mâak bpai lɛ́ɛo		It’s/That’s too much!		
1118	18	56	มันไม่โอเค	man mâi oo-kee		It’s not okay.		
1119	19	56	ถามทำไม	tǎam tam-mai		Why do you ask?		
1120	20	56	ยิ้มอะไร(ครับ/คะ)	yím à-rai (kráp/ká)		What are you smiling at?		
1121	1	57	ไม่ต้องอาย	mâi-dtɔ̂ng aai		Don’t be shy. / You don’t need to be shy.		
1122	2	57	แปลกจริงๆ	bplɛ̀ɛk jing-jing		It’s so strange. / That’s really weird.		
1123	3	57	ฉันกลัว	chǎn glua		I’m scared/afraid.		
1124	4	57	ฉันไม่ได้กลัว	chǎn mâi-dâi glua		I’m not scared/afraid.		
1125	5	57	เขาเป็นใคร	kǎo bpen krai		Who is she? / Who is he? / Who are they?	พวกเขา (pûak-kǎo) is the ‘proper’ way to say ‘they’ but sometimes it’s shortened to just เขา (kǎo).	
1126	6	57	มองผมสิ	mɔɔng pǒm sì		Look at me.		
1127	7	57	มีคนให้มา	mii kon hâi maa		Someone gave it to me. / Somebody gave me this.		
1128	8	57	เสร็จแล้ว	sèt lɛ́ɛo		All finished. / (We)’re all finished. / (We)’re done.		
1129	9	57	มันน่าเบื่อ	man nâa-bʉ̀a		It’s boring.		
1130	10	57	ลดหน่อยได้ไหมคะ	lót nɔ̀i dâi mǎi ká		Can you give me a discount? / Can you lower the price?		
1131	11	57	ฉันไม่ได้ทำนะ	chǎn mâi-dâi tam ná		I didn’t do it!		
1132	12	57	ไม่แน่ใจ	mâi-nɛ̂ɛ-jai		(I)’m not sure.		
1133	13	57	(เขา)จมน้ำตาย	(kǎo) jom-náam-dtaai (		He) drowned.		
1134	14	57	คุณสวยมากเลย	kun sǔai mâak ləəi		You’re so beautiful!		
1135	15	57	คอแห้ง	kɔɔ hɛ̂ng		My throat’s dry. / I’m thirsty.		
1136	16	57	ขอฉันดูหน่อย	kɔ̌ɔ chǎn duu nɔ̀i		Let me see (it). / Let me have a look.		
1137	17	57	เราจะรวย	rao jà ruai		We’ll be rich! / We’ll make loads of money!		
1138	18	57	คุณทำได้	kun tam dâi		You can do it.		
1139	19	57	ผมเลี้ยงเอง	pǒm líang eeng		It’s my treat. / My treat.		
1140	20	57	ไว้เจอกันนะ	wái jəə-gan ná		See you later.		
1141	1	58	เข้มแข็งไว้(นะ)	kêm-kɛ̌ng wái (ná)		Be strong. (emotionally)		
1142	2	58	ไม่เคยทำร้ายใคร	mâi-kəəi tam-ráai krai (		He)’s never hurt anybody. / (It) never hurt anyone.		
1143	3	58	ฉันอยากจะย้อนเวลา(กลับไป)	... chǎn yàak jà yɔ́ɔn wee-laa (glàp-bpai)...		I wanna turn back the clock… / I want to go back in time… / I wish I could go back in time…		
1144	4	58	หายเข้าไปใน(ป่า)	hǎai kâo bpai nai (bpàa) (		He) disappeared into the (forest).		
1145	5	58	อยากให้ของขวัญ แต่ไม่รู้จะให้อะไร	yàak hâi kɔ̌ɔng-kwǎn dtɛ̀ɛ mâi-rúu jà hâi à-rai		I wanna get (her) something, but don’t know what to get.		
1146	6	58	ฉันไม่สมควรได้รับ(มัน)	chǎn mâi sǒm-kuan dâi-ráp (man)		I don’t deserve (it). / I didn’t deserve (it).		
1147	7	58	ไม่มีวี่แววของ(ฝน)	mâi-mii wîi-wɛɛo kɔ̌ɔng (fǒn)		There’s no sign of (rain). / It doesn’t look like it’s going to (rain).		
1148	8	58	มันเป็นแค่ภาพลวงตา	man bpen kɛ̂ɛ pâap-luang-dtaa		It’s just an illusion. / It’s just a mirage. / It’s just a hallucination.		
1149	9	58	เขาบริจาคเงินให้กับ(การกุศล)	kǎo bɔɔ-rí-jàak ngən hâi-gàp (gaan-gù-sǒn)		He donated/gave money to (charity).		
1150	10	58	มีเวลาไม่มาก	mii wee-laa mâi mâak		You don’t have much time. / There isn’t much time.		
1151	11	58	ยังหนุ่มยังแน่น	yang nùm yang nɛ̂n		(He)’s still young and fit/strong.		
1152	12	58	ไม่งั้น	... mâi-ngán...		Otherwise… / If not...		
1153	13	58	ไม่มีอะไรมากกว่านั้น	mâi-mii à-rai mâak-gwàa nán		There’s nothing more. / There’s nothing else.		
1154	14	58	ปกปิดความจริง	bpòk-bpìt kwaam-jing		hide the truth / cover up the truth		
1155	15	58	เขาทำได้ทุกอย่าง	kǎo tam-dâi túk-yàang		He can do it all. / He can do anything. / He can do everything.		
1156	16	58	คุยอะไรกันอยู่(เหรอ)	kui à-rai gan yùu (rə̌ə)		What are you guys/two talking about?		
1157	17	58	ลืมของไว้(ในรถ)	lʉʉm kɔ̌ɔng wái (nai rót) (		You) left something (in the car).		
1158	18	58	(มันก็)แปลกดีนะ	(man gɔ̂ɔ) bplɛ̀ɛk dii ná		It’s weird. / It’s strange. / It’s funny.		
1159	19	58	หลีกเลี่ยงไม่ได้	lìik-lîang-mâi-dâi		It’s inevitable/unavoidable.		
1160	20	58	ลุยให้เต็มที่	lui hâi dtem-tîi	SLANG	Go all out! / Give it your best shot! / Break a leg!		
1161	1	59	เธออาจจะติดคุก	təə àat-jà dtìt-kúk		You could go to jail.		
1162	2	59	ไม่อยากติดคุก	mâi-yàak dtìt-kúk		I don’t wanna go to jail.		
1163	3	59	(คุณ)ดูเปลี่ยนไป	(kun) duu bplìan-bpai		You look different. / You seem different.		
1164	4	59	เขาช่วยชีวิตผม	kǎo chûai-chii-wít pǒm		He saved my life. / He rescued me.		
1165	5	59	เคยทำมาแล้ว	kəəi tam maa lɛ́ɛo		I’ve done that (before).		
1166	6	59	ไม่ค่อยได้นอน	mâi-kɔ̂i dâi-nɔɔn		I don’t get much sleep. / I didn’t sleep much. / I haven’t slept much.		
1167	7	59	บอกมาเลยว่า	...  bɔ̀ɔk maa ləəi wâa...	BIT STRONG	(Just) tell me...		
1168	8	59	ถ้าเลือกได้	... tâa lʉ̂ak dâi...		If I could choose… / If I had a choice… / If given a choice…		
1169	9	59	หยุดคิดเรื่อง... ไม่ได้	yùt kít rʉ̂ang... mâi-dâii (		I) can’t stop thinking about…		
1170	10	59	เข้ามาได้ยังไง	kâo-maa dâi yang-ngai		How did you get in here?!		
1171	11	59	ตั้งใจฟังให้ดี	dtâng-jai fang hâi-dii		Listen carefully! / Listen to me carefully!		
1172	12	59	ถามไปแล้ว	tǎam bpai lɛ́ɛo		(I) asked already.		
1173	13	59	เก็บเป็นความลับ	gèp bpen kwaam-láp		Keep it (a) secret.		
1174	14	59	มีเรื่องสำคัญจะบอก	mii rʉ̂ang sǎm-kan jà bɔ̀ɔk (		I) have something important to tell you.		
1175	15	59	…ดีพอสำหรับฉัน	…dii pɔɔ sǎm-ràp chǎn		…is good enough for me.		
1176	16	59	มีแฟนหรือยัง	mii fɛɛn rʉ̌ʉ yang		Do you have a boy/girlfriend?		
1177	17	59	ยังไม่นอนอีกเหรอ	yang mâi nɔɔn ìik rə̌ə		Are you still awake? / You’re still up? / You’re not sleeping yet?		
1178	18	59	ไม่มีใครรักฉัน	mâi-mii-krai rák chǎn		No one loves me! / Nobody loves me!		
1179	19	59	ดูไม่ดีเลย	duu mâi-dii ləəi		(You) don’t look so good. / (You) don’t look well. / (It) doesn’t look (so) good.		
1180	20	59	ไม่มีอะไรพิเศษ	mâi-mii-à-rai pí-sèet		Nothing special. / I didn’t do anything special.		
1181	1	60	ใช่ใช่ใช่	châi châi châi		Yes! Yes! Yes! / Yeah, yeah, yeah.		
1182	2	60	ไม่ไม่ไม่	mâi mâi mâi		No! No! No! / No, no, no.		
1183	3	60	เอาไหม(ครับ/คะ)	ao mǎi (kráp/ká)		Do you want one? / Do you want some? / Want some?		
1184	4	60	ยังไม่แน่ใจ	yang mâi-nɛ̂ɛ-jai		(I)’m not sure yet.		
1185	5	60	ได้โปรด	dâi-bpròot	FORMAL	Please! / Please…		
1186	6	60	ผมมีนัดกับ(คุณ... )	pǒm mii nát gàp (kun...)		I have an appointment with…		
1187	7	60	เป็นผมเอง	bpen pǒm eeng		That’s me. / That was me.		
1188	8	60	ไม่อยากรู้	mâi-yàak rúu		(I) don’t wanna know.		
1189	9	60	ผมชอบกิน(มะม่วง)	pǒm chɔ̂ɔp gin (má-mûang)		I like (mangoes).		
1190	10	60	ชอบกิน(มะม่วง)เรือ	chɔ̂ɔp gin (má-mûang) rə̌ə		Do you like (mangoes)?		
1191	11	60	ชอบกินมาก	chɔ̂ɔp gin maâk		I love them. / I love it.		
1192	12	60	ผมไม่ชอบกิน(มะม่วง)	pǒm mâi chɔ̂ɔp gin (má-mûang)		I don’t like (mangoes).		
1193	13	60	น่ากิน(จังเลย)	nâa-gin (jang ləəi)		Looks good! / Looks delicious! / Yum!		
1194	14	60	(ฉัน)ไม่อยากไป	(chǎn) mâi-yàak bpai (		I) don’t wanna go.		
1195	15	60	ปวดหัว	bpùat-hǔa		I have a headache.		
1196	16	60	ยังไม่ตาย	yang mâi dtaai		You’re still alive. / You’re not dead yet!		
1197	17	60	นี่(ครับ/ค่ะ)	nîi (kráp/kà)		Here you are. / Here you go. (handing something to someone)		
1198	18	60	เยี่ยม	yîam		Great! / Excellent!		
1199	19	60	ตลกดี(นะ)	dtà-lòk dii (ná)		That’s funny! / He’s funny.		
1200	20	60	เดี๋ยวๆ(ๆ)	dǐao-dǐao		Wait, wait. / Whoa—wait a second.		
1201	1	61	ตกใจหมดเลย	dtòk-jai mòt ləəi		You scared me! / You scared the hell out of me! / I was shocked!		
1202	2	61	มันเป็นเรื่องบังเอิญ	man bpen rʉ̂ang-bang-əən		It’s a coincidence.		
1203	3	61	หน้าเด็กจัง	nâa dèk jang		(You) look so young! / (You) have such a baby face!		
1204	4	61	มีเคล็ดลับอะไร	mii klét-láp à-rai		What’s your secret? (to looking young, etc.)		
1205	5	61	ขยันจัง(เลย)	kà-yǎn jang (ləəi) (		You)’re so hardworking! / So diligent! / (You)’re such a hard worker!		
1206	6	61	ตอบตกลง	dtɔ̀ɔp dtòk-long		Say yes. / Said yes. (answered yes and agreed to something)		
1207	7	61	(พี่)มาหาเพื่อน	(pîi) maa-hǎa pʉ̂an (		I) came to visit a friend. / (I)’m visiting a friend.	The speaker uses พี่ (pîi) here because s/he is older than the listener.	
1208	8	61	คุณต้องเข้าใจ(นะครับ)(... )	kun dtɔ̂ng kâo-jai (ná-kráp) (…)		You have to understand(…)		
1209	9	61	เป็นเพื่อนกันตลอดไป	bpen pʉ̂ang gan dtà-lɔ̀ɔt-bpai (		We’ll be) friends forever.		
1210	10	61	เกิดอุบัติเหตุขึ้น	gə̀ət ù-bàt-dtì-hèet kʉ̂n		There was an accident. / There’s been an accident.		
1211	11	61	ดูท่าว่า	... duu tâa-wâa...		It seems like… / It looks like…		
1212	12	61	ขายไม่ออก	kǎai-mâi-ɔ̀ɔk		(We) can’t sell it. / (We) were unable to sell them.		
1213	13	61	เหมือนเทพนิยาย	mʉ̌an têep-ní-yaai		(It’s) like a fairy tale.		
1214	14	61	ใครเล่นเป็น(นางเอก)	krai lên bpen (naang-èek)		Who (plays) the (lead actress)?		
1215	15	61	เขาเสียเลือดมาก	kǎo sǐa lʉ̌at mâak		He lost a lot of blood. (in an accident, an operation, etc.)		
1216	16	61	ทุกอย่างเรียบร้อยดี	túk-yàang rîap-rɔ́ɔi-dii		Everything’s fine. / Everything’s under control. / Everything’s all right.		
1217	17	61	คุณต้องสัญญากับผม	kun dtɔ̂ng sǎn-yaa gàp pǒm		You have to promise me. / You must promise me.		
1218	18	61	ทะเลาะเรื่องอะไร	tá-lɔ́ rʉ̂ang à-rai		What were (you) arguing about? / What did (you) have a fight about?		
1219	19	61	ขอตัวไปนอนก่อน	kɔ̌ɔ-dtua bpai nɔɔn gɔ̀ɔn		I’m going to bed. / I’m gonna turn in now.		
1220	20	61	มันจั๊กจี้	man ják-gà-jîi		It tickles!		
1221	1	62	ฝันไปเถอะ	fǎn bpai tə̀		In your dreams! / You’re dreaming! / Dream on!		
1222	2	62	จะเริ่มตรงไหนดี(ครับ)	jà rə̂əm dtrong-nǎi dii (kráp)		Where do I start? / Where do I begin?		
1223	3	62	(ฉัน)ไม่ได้ข่าวจาก(เขา)	(chǎn) mâi-dâi kàao jàak (kǎo) (		I) haven’t heard from (him).		
1224	4	62	มีอะไรมากกว่านั้น	mii à-rai mâak-gwàa nán		There’s something more. / There’s something else.		
1225	5	62	ข่าวล่าสุด	kàao lâa-sùt		The latest / The latest news		
1226	6	62	แต่ละคนมีนิยาม(ความสุข)ที่ต่างกัน	dtɛ̀ɛ-lá kon mii ní-yaam (kwaam-sùk) tîi dtàang-gan		Everyone/Each of us has a different definition of (happiness).		
1227	7	62	…วันรุ่งขึ้น	...  ...wan-rûng-kʉ̂n...	SEMI-LITERARY	The next day… / …the next day.		
1228	8	62	() ถูกยกให้เป็น(รถที่ปลอดภัยที่สุด) ()	tùuk-yók-hâi-bpen (rót tîi bplɔ̀ɔt-pai tîi-sùt)		() is considered to be (the safest car). / () was called (the safest car). / () was described as (the safest car).		
1229	9	62	นั่นแหละชีวิต	nân-lɛ̀ chii-wít		That’s life!		
1230	10	62	ไม่เคยมีประสบการณ์มาก่อน	mâi-kəəi mii bprà-sop-gaan maa-gɔ̀ɔn (		I) have no experience. / (I) have no previous experience.		
1231	11	62	ไม่จำเป็นต้องมีประสบการณ์มาก่อน	mâi-jam-bpen dtɔ̂ng mii bprà-sop-gaan maa-gɔ̀ɔn		No experience necessary. / You don’t need to have any previous experience.		
1232	12	62	ไม่ได้มีแต่(อาหาร แต่ยังมี กาแฟ และ…)	mâi-dâi mii dtɛ̀ɛ (aa-hǎan dtɛ̀ɛ		yang mii gaa-fɛɛ lɛ́...)/(Our restaurant) doesn’t only/just have (food, but we have coffee and…)		
1233	13	62	(…)อีกไม่กี่วัน(... ) (…)	ìik-mâi-gìi wan(…)		In (just) a few days(…) / …any day (now).		
1234	14	62	(…)อีกไม่กี่นาที(... ) (…)	ìik-mâi-gìi naa-tii(…)		In (just) a few minutes(…) / …any minute (now).		
1235	15	62	หล่นมาจาก(ฟ้า)	lòn maa-jàak (fáa) (		It) fell out of/dropped from (the sky).		
1236	16	62	(เรื่องนี้)สอนให้รู้ว่า	... (rʉ̂ang níi) sɔ̌ɔn hâi rúu wâa...		The moral of the story is… / It teaches (us)…		
1237	17	62	ไม่มีร่องรอย(การต่อสู้)	mâi-mii rɔ̂ng-rɔɔi (gaan-dtɔ̂ɔ-sûu)		There was no trace/sign (of a struggle).		
1238	18	62	ทำ(ความ)ฝันให้เป็นจริง	tam-(kwaam)fǎn -hai-bpen-jing		Make a dream come true. / Make a dream become reality.		
1239	19	62	แน่อยู่แล้ว	nɛ̂ɛ yùu-lɛ́ɛo		Sure. / I’m sure it was. / Absolutely. / Of course (it is).		
1240	20	62	สับสนไปหมด	sàp-sǒn bpai mot		I’m so confused! / It’s so confusing!		
1241	1	63	ฉันท้อง	chǎn tɔ́ɔng		I’m pregnant!		
1242	2	63	ขับช้าๆ	kàp chá-chá		Drive slowly.		
1243	3	63	ระวังหน่อย	rá-wang nɔ̀i		Be careful. / Watch it!		
1244	4	63	เห็น… ไหม	hěn... mǎi		Did you see…? / Have you seen…?		
1245	5	63	ไม่เห็น(นะ)	mâi-hěn (ná)		No, (I) didn’t/haven’t. / No.		
1246	6	63	อีกนิดหนึ่ง	ìik nít-nʉ̀ng		A bit more. / A little more.		
1247	7	63	คุณพูดถูก	kun pûut tùuk		You’re right. / You were right. (what you said is true)		
1248	8	63	คุณพูดผิด	kun pûut pìt		You’re wrong. / You were wrong. (what you said isn’t true)		
1249	9	63	ไม่เท่าไร	mâi tâo-rai		Not so much. / Not really. / Not very.		
1250	10	63	สาธุ	sǎa-tú		Amen!		
1251	11	63	ขอบคุณ(มาก)นะคะคุณหมอ	kɔ̀ɔp-kun (mâak) ná-ká kun mɔ̌ɔ		Thank you (very much) Doctor.		
1252	12	63	สัญญากับผม(ว่า... )	sǎn-yaa gàp pǒm (wâa...)		Promise me (that...)		
1253	13	63	กุญแจอยู่ในรถ	gun-jɛɛ yùu nai rót		The key’s in the car. / The keys are in the car.		
1254	14	63	ดีกว่ามาก	dii-gwàa mâak		Much better.		
1255	15	63	ฝนกำลังจะตก	fǒn gam-lang jà dtòk		It’s going to rain.		
1256	16	63	มานั่ง(สิ)	maa nâng (sì)	INFORMAL	Come sit. / Come and sit down. / Come. Have a seat.		
